{
    "sourceID": "EuropePMC",
    "validated_against_schema_version": "1.2",
    "unique_association_fields": {
        "target": "http://identifiers.org/P43116",
        "publicationID": "http://identifiers.org/pubmed/18989535",
        "disease_uri": "http://www.ebi.ac.uk/efo/EFO_0000249"
    },
    "evidence_chain": {
        "type": "generic_evidence_chain",
        "chain": [
            {
                "target_type": "http://identifiers.org/cttv.target/protein",
                "activity": "http://identifiers.org/cttv.activity/up_or_down",
                "about": [
                    "http://identifiers.org/uniprot/P43116"
                ]
            },
            {
                "association_score": [
                    {
                        "value": 0.6,
                        "type": "probability",
                        "method": "Custom text-mining method for target-disease association"
                    }
                ],
                "provenance_type": [
                    {
                        "type": "literature",
                        "lit_refs": [
                            "http://identifiers.org/pubmed/18989535"
                        ],
                        "extracted_sentences": [
                            "a novel proinflammatory and proamyloidogenic function for the PGE2 EP2 receptor is demonstrated in a model of familial Alzheimer's disease."
                        ]
                    }
                ],
                "is_associated": true,
                "date_asserted": "2014-05-20T00:00:00Z",
                "evidence_codes": [
                    "http://www.targetvalidation.org/evidence/literature_mining",
                    "http://purl.obolibrary.org/obo/ECO_0000204"
                ],
                "preferred_hyperlink_1" : {
                	"nice_name" : "View article in EuropePMC",
                	"url" : "http://europepmc.org/search?page=1&query=PMCID:PMC18989535&sortby=Date"
                }
            },
            {
                "about": [
                    "http://www.ebi.ac.uk/efo/EFO_0000249"
                ]
            }
        ]
    }
}