{
    "sourceID": "primarysubmitterID",
    "validated_against_schema_version": "1.2",
    "unique_association_fields": {
        "chembl_targets": "http://identifiers.org/uniprot/P23219,http://identifiers.org/uniprot/P35354",
        "chembl_molecules": "http://identifiers.org/chembl.compound/CHEMBL6",
        "atc_classification": "http://identifiers.org/atc/M02AA23",
        "efo_classification": "http://purl.obolibrary.org/obo/HP_0003326"
    },
    "evidence_chain": {
        "type": "generic_evidence_chain",
        "chain": [
            {
                "about": [
                    "http://identifiers.org/ensembl/ENSG00000139618"
                ],
                "target_type": "http://identifiers.org/cttv.target/gene",
                "activity": "http://identifiers.org/cttv.activity/tolerated_by_target",
                "target_name": "optional target name"
            },
            {
                "association_score": [
                    {
                        "type": "pvalue",
                        "value": 0.0000418,
                        "method": "Moderated t-statistics computed with limma version 3.16.8. Independent filtering performed using genefilter version 1.46.1, with gene variances as filter statistic. p-values adjusted using Benjamini & Hochberg (1995) FDR correction. By default, significant differential expression called if adjusted p <= 0.05."
                    }
                ],
                "evidence_codes": [
                    "http://purl.obolibrary.org/obo/ECO_0000205"
                ],
                "provenance_type": [
                    {
                        "type": "database",
                        "version": "111111",
                        "id": "Expression_Atlas"
                    }
                ],
                "preferred_hyperlink_1": {
                    "url": "http://www.ebi.ac.uk/gxa/genes/ENSG00000127720",
                    "nice_name": "Baseline gene expression in Expression Atlas"
                },
                "preferred_hyperlink_2": {
                    "url": "http://www.ebi.ac.uk/gxa/genes/ENSG00000127720",
                    "nice_name": "Baseline gene expression in Expression Atlas"
                },
                "date_asserted": "2015-02-16T09:54:13Z",
                "is_associated": true
            },
            {
                "about": [
                    "http://www.ebi.ac.uk/efo/EFO_0000637"
                ],
                "biosamples": [
                    "breast tissue biopsy"
                ]
            }
        ]
    }
}